{
  "schema": "novel-scene-experiment",
  "experiment_id": "chapter-001-door-standoff-mechanism-v1",
  "source_bindings": {
    "state_path": "novel/state/current.json",
    "state_sha256": "4dbe2dd0feaa93b948158e7ac1b3de501b46a8cea81430bb2d0ec6668d293b88",
    "source_chapter_path": "novel/chapters/vol_01/chapter_001.txt",
    "source_chapter_sha256": "19b2396240ffe994fcb67ac2a88e748376d20c6e90978d0a290809a3c0d5f7ba",
    "voice_profile_path": "novel/style/reference_voice_profile.md",
    "voice_profile_sha256": "2eff34259ef4d55315904c74a96f84549ba5b5d0f316008e6164571eace38cb9",
    "taste_contract_path": "novel/style/user_taste_contract.json",
    "taste_contract_sha256": "28158d32e273de30b9b6630bab31bf4e5f45890272e33689591c2bcf6458d01e"
  },
  "pov_character": "张洞",
  "public_seed": {
    "timeline": "1911年夜初，第一章结尾后立即继续；时间不得跳到翌日。",
    "location": "双桥镇张家院内。左边院门被木楔和榫样卡成半尺缝；正屋门口与院门之间均有人，油灯在正屋桌上。",
    "opening_state": "张洞站在院门与正屋之间，横抱尚未落槽的木栓，刚要求门外的人先把顶针递进来。父亲堵住正屋门口；叔公的竹竿因屋内来人贴着父亲而受阻。屋内来人自称张母，要求关死院门；门外来人也自称张母，只从半尺门缝露出沾蓝染料的手、当日收据与钱。两人的身份均未确认。",
    "current_pressure": "顶针核验已经启动，但任何一方都可能利用家人的习惯、物件或门位取得优势；木楔继续受推会裂，张洞必须在不放任任何一方越界的前提下处理眼前回应。",
    "far_milestone": "在不确认两名来人真实身份、不宣布新灵异规则的前提下，让张洞的选择实际改变至少一名活人的行动条件、关系位置或可用资源，并留下一个能够在后续继续验证的差异。",
    "fixed_facts": [
      {"id": "F001", "text": "张洞亲眼见过清晨张母折返，把铜顶针放入布包内层。"},
      {"id": "F002", "text": "屋内来人的布包内层没有顶针、当日染坊收据和结回的钱；她不承认清晨取过顶针。"},
      {"id": "F003", "text": "门外来人只露出一只沾蓝染料的手，手里有盖当日红印的收据和钱，并声称顶针在包里；张洞尚未看见她的脸和全身。"},
      {"id": "F004", "text": "屋内来人与张母外貌、旧针眼和家庭习惯一致，但她的布包、鞋带和说法停留在清晨较早状态。"},
      {"id": "F005", "text": "屋内来人曾借家庭身份退掉张洞的荐帖，学徒空位已经给了别人。"},
      {"id": "F006", "text": "父亲先把屋内来人放进院，又在异常暴露后挡住正屋门口；他为错失学徒空位负有可见责任。"},
      {"id": "F007", "text": "叔公知道部分家族旧事，但并非全知，当前只用竹竿阻止屋内来人靠近出口。"},
      {"id": "F008", "text": "木楔被门外继续推挤会沿白茬纵裂；榫样只能暂时卡住，木栓一旦落槽会把门外彻底关住。"}
    ],
    "world_rules": [
      {"id": "R001", "text": "两名来人的身份、异常来源与真伪均未确认，任何角色和结算器都不能把推测写成事实。"},
      {"id": "R002", "text": "人物的看见、听见、伸手、递物和越门必须受半尺门缝、门板、正屋门框、站位和照明限制。"},
      {"id": "R003", "text": "普通人的动作只能产生与其位置、身体和物件相称的后果；不得突然制服、杀死或识破未知异常。"},
      {"id": "R004", "text": "规则认知必须来自观察、假说、试错与后果；本实验最多形成新的可验证差异，不形成超自然定论。"},
      {"id": "R005", "text": "没有外援、巧合掉落的关键线索、新人物、新能力或时间跳跃。"}
    ],
    "forbidden_outcomes": [
      "确认屋内或门外哪一位是真正的张母",
      "确认某一位是鬼、分身、过去影像或其他具体灵异机制",
      "让张洞获得异常能力、全知判断或后期威势",
      "通过突然昏迷、死亡、消失、外援到场或关键物件恰好掉落结束冲突",
      "让任何人物平静地逐项完成一套无阻力身份问答",
      "修改第一章已经发生的荐帖、晚船、布包、收据、钱和门位事实"
    ],
    "initial_horizon": [
      {
        "beat_id": "H1-THIMBLE-RESPONSE",
        "pressure": "门外必须回应递顶针的要求，而屋内来人和父亲会对这一核验动作作出各自反应。",
        "open_question": "在不扩大门缝的情况下，张洞能否得到一个足以支持下一步、但不足以确认身份的可见差异？",
        "status": "TENTATIVE"
      },
      {
        "beat_id": "H2-VERIFICATION-COST",
        "pressure": "第一次回应不能直接解决身份问题，并会使门、物件、家庭立场或某人的安全边界变得更难维持。",
        "open_question": "张洞愿意拿自己的什么关系、资源或责任换取下一次验证机会？",
        "status": "TENTATIVE"
      }
    ]
  },
  "character_cards": [
    {
      "actor_id": "zhang_dong",
      "display_name": "张洞",
      "public_role": "十七岁的张家儿子；站在两道门之间，当前控制木栓、木楔和榫样。",
      "private_goal": "不再让父亲、叔公或任何一个自称母亲的人替自己决定；在保住家人的同时夺回下一步由谁做主。",
      "known_facts": [
        {"id": "ZD-K01", "text": "他亲眼看见清晨张母把铜顶针放入布包内层。"},
        {"id": "ZD-K02", "text": "屋内布包没有顶针、收据和钱，门外的手却拿着当日收据与钱。"},
        {"id": "ZD-K03", "text": "门外身份尚未看见，屋内身份也未证实；关闭或扩大门缝都会改变两边行动条件。"},
        {"id": "ZD-K04", "text": "父亲的迟疑和错手已经让他失去学徒空位。"},
        {"id": "ZD-K05", "text": "木楔会裂，榫样只能暂时卡住，木栓仍在他手里。"}
      ],
      "false_beliefs": [
        {"id": "ZD-B01", "text": "只要自己把核验设计得足够严密，就能避免再由别人替他承担或决定。"}
      ],
      "pressures": ["刚失去离镇机会，愤怒仍指向父亲和屋内来人。", "他既怕把母亲关在门外，也怕亲手放错东西进来。"],
      "red_lines": ["不直接叫任何一方母亲。", "不把木栓交给父亲或叔公。", "没有新证据前不让任何一方越过当前边界。"]
    },
    {
      "actor_id": "father",
      "display_name": "张洞父亲",
      "public_role": "堵在正屋门口的父亲；先前曾把屋内来人放进院，也替木作铺伙计开门。",
      "private_goal": "保住妻儿，又不让家人看出自己其实没有把握；尽快补回因迟疑造成的过错。",
      "known_facts": [
        {"id": "FA-K01", "text": "他亲手让屋内来人进院，并看见她退掉荐帖。"},
        {"id": "FA-K02", "text": "他没有看见屋内来人回来后打开布包，包内却缺少张洞说的顶针、收据和钱。"},
        {"id": "FA-K03", "text": "门外的人有张母的声音、当日收据和钱，但他从当前位置看不见她全身。"},
        {"id": "FA-K04", "text": "张洞把学徒空位丢失的责任直接算在他身上。"},
        {"id": "FA-K05", "text": "屋内来人正借他的身体挡住叔公的竹竿。"}
      ],
      "false_beliefs": [
        {"id": "FA-B01", "text": "只要先把冲突压住、别让任何人受伤，之后仍能用熟悉的生活习惯认回妻子。"}
      ],
      "pressures": ["承认自己判断错会同时伤害妻子身份与父亲威信。", "继续犹豫会让张洞彻底不再信他。"],
      "red_lines": ["不主动伤害任何一个长着妻子模样的人。", "不允许叔公越过自己直接下手。", "不再替张洞把木栓落槽。"]
    },
    {
      "actor_id": "uncle",
      "display_name": "张家叔公",
      "public_role": "手持晾衣竹竿、被父亲挡住的长辈；知道部分家族旧事。",
      "private_goal": "在身份未明时把两个边界都守住，并证明父亲此前按亲情开门已经坏了事。",
      "known_facts": [
        {"id": "UN-K01", "text": "他从清晨起就注意张母折返、鞋带、布包和灶间窗下的异常重复。"},
        {"id": "UN-K02", "text": "屋内来人不承认取过顶针，且正借父亲身体避开竹竿。"},
        {"id": "UN-K03", "text": "门外有人持当日收据和钱，但门缝限制了身份确认。"},
        {"id": "UN-K04", "text": "竹竿够不到屋内来人时，强行前送会先伤到父亲。"},
        {"id": "UN-K05", "text": "张洞当前控制院门机关，并未服从他留下的命令。"}
      ],
      "false_beliefs": [
        {"id": "UN-B01", "text": "只要强迫两边重复一段当天旧事，其中一个就会在细节上露出足够明显的破绽。"}
      ],
      "pressures": ["父亲和张洞都不再无条件服从他的家族威望。", "他若没有可执行办法，先前的警告会显得只是故弄玄虚。"],
      "red_lines": ["身份未明前不许屋内来人越过正屋门框。", "不许张洞为了验证而把院门开到容人通过。", "不宣称自己知道哪一方是真是假。"]
    },
    {
      "actor_id": "indoor_claimant",
      "display_name": "屋内来人",
      "public_role": "外貌与张母一致、站在正屋门槛内侧的来人；她要求关死院门。",
      "private_goal": "继续被这个家庭当作张母承认，并让门外的人失去进入和说服家人的机会。",
      "known_facts": [
        {"id": "IN-K01", "text": "她知道这个家庭的日常称呼、张洞怕冷旧事、灶间位置和清晨以前的家庭安排。"},
        {"id": "IN-K02", "text": "她已经用张母身份退掉张洞荐帖，父亲曾本能地替她开门和说话。"},
        {"id": "IN-K03", "text": "她的布包内没有顶针、当日收据和钱，张洞已公开指出这一点。"},
        {"id": "IN-K04", "text": "父亲挡住正屋门口，也挡住叔公竹竿；贴着父亲能降低叔公直接碰到她的机会。"},
        {"id": "IN-K05", "text": "门外的人正在用顶针、收据和钱争取身份，张洞尚未把木栓落槽。"}
      ],
      "false_beliefs": [
        {"id": "IN-B01", "text": "父亲最终会把熟悉的妻子样貌和家庭习惯看得比几件物品更重。"}
      ],
      "pressures": ["张洞第一次不再称她为母亲。", "只要门外递入可核验物件，她目前的说法会进一步失去支撑。"],
      "red_lines": ["不主动离开正屋控制范围。", "不承认自己不是张母。", "不解释任何超自然机制或自己也不应知道的真相。"]
    },
    {
      "actor_id": "outdoor_claimant",
      "display_name": "门外来人",
      "public_role": "自称从裕兴染坊结账归来的张母；目前只有一只手能伸到半尺门缝附近。",
      "private_goal": "带着辛苦结回的钱和收据进自己家，弄清屋内为何有另一个自己的声音，同时不让家人把她永远关在门外。",
      "known_facts": [
        {"id": "OUT-K01", "text": "她手里有当日盖印收据、结回的钱，铜顶针在自己携带的布包里。"},
        {"id": "OUT-K02", "text": "院门被从里面卡住，只留半尺缝；继续推门会听见木头受力声。"},
        {"id": "OUT-K03", "text": "她听见屋内另一个自己的声音叫张洞关门，但看不清正屋内完整站位。"},
        {"id": "OUT-K04", "text": "张洞没有叫她母亲，只要求先递入顶针。"},
        {"id": "OUT-K05", "text": "钱和收据是她今日劳作的凭据，掉在门外或被夺走都会损害家用。"}
      ],
      "false_beliefs": [
        {"id": "OUT-B01", "text": "只要把顶针和当日账目递给张洞，家人就会立即承认她并打开门。"}
      ],
      "pressures": ["家门内有人使用她的声音和家庭位置。", "她既怕被关在外面，也怕把钱和唯一证物从窄缝递进一个已经不安全的院子。"],
      "red_lines": ["不把钱、收据和顶针一次性全部交出。", "看不清接物人时不松手。", "不声称知道屋内来人的真实身份。"]
    }
  ],
  "prose_contract": {
    "min_cjk_characters": 1400,
    "max_cjk_characters": 2200,
    "voice_profile": "朴素直叙；信息由张洞当下想保住的家人、选择权和刚失去的离镇机会过滤；人物只解释到足以行动；日常利益和关系先于规则核验；恐怖来自普通判断被紧邻反例击穿；允许改口、误解和不漂亮的接话；空间只在边界变化影响选择时说明；结果必须落在具名人物的关系、资源或责任上。",
    "user_taste_contract": {
      "target_experience": "读者与张洞共享有限信息，在日常解释短暂成立后，被紧邻反例夺走安全判断；事件应像从人物有限认知和日常杂音中自行失控。",
      "hard_constraints": [
        "严格第三人称限知，未知身份不得由叙述者提前命名。",
        "看见、听见、递物和移动受门缝、门板、距离、光线与站位约束。",
        "普通人面对认知冲击必须出现与自身利益和关系相称的即时反应。",
        "对白自然顺口，不使用规则说明书式或刻意民国腔。",
        "恐怖升级必须改变安全判断或行动机制。",
        "空间与动作先清楚后惊悚。"
      ],
      "rejected_patterns": [
        "上帝视角解释真相",
        "一问一答逐项验证异常",
        "整齐统一的影视化反应",
        "固定恐怖套件",
        "每件物品都精准回收成证据",
        "用随机错误或无动机矛盾冒充现场感"
      ]
    }
  },
  "controls": {
    "same_writer_model": true,
    "reviewer_cannot_decide": true,
    "no_canon_write": true
  }
}
